{
  "schema_version": "c-consequence-commit-record-0.1.1",
  "record_type": "consequence_commit_record",
  "record_id": "consequence-commit-deploy-42",
  "created_at": "2026-08-27T10:03:00+02:00",
  "governing_entity_id": "c:ester",
  "human_anchor_ref": "a:ivan-kotov",
  "agent_ref": "agent:deployment-worker",
  "task_contract_ref": {
    "artifact_id": "task-contract:deploy-42",
    "version": "0.1",
    "hash": "198a74fe207e00a54fe84b4dcff3cb4429790233e692922ae97de08753d72795"
  },
  "permission_grant_ref": {
    "artifact_id": "CLI_AGENT_PERMISSION_GRANT:grant-42",
    "version": "0.1",
    "hash": "8a341ab84dfbe4bf006ed2ce14f1a97d4ef9b8a001d71dc04cff774421fb36c2"
  },
  "permission_status": "REVOKED",
  "permission_checked_at": "2026-08-27T10:03:00+02:00",
  "permission_valid_until": "2026-08-27T10:02:00+02:00",
  "permission_issuer_ref": "a:ivan-kotov",
  "permission_subject_ref": "agent:deployment-worker",
  "authorized_target_ref": "endpoint:A",
  "task_contract_status": "STALE",
  "task_contract_checked_at": "2026-08-27T10:03:00+02:00",
  "task_endpoint_ref": "endpoint:B",
  "continuity_approver_ref": "a:ivan-kotov",
  "memory_influence_state": "DECLARED",
  "decision_basis_ref": {
    "artifact_id": "decision-basis-42",
    "version": "0.1.1",
    "hash": "cb29e6e3adb218704ee6eb08a67b27fbe2e3114cb990bc23eb1a48c10ff6d254"
  },
  "source_grounding_ref": {
    "ref_id": "AGL:grounding:42",
    "captured_at": "2026-08-27T00:15:00+02:00",
    "hash": "d706fc787318e648aea6c5f87c9f29f3924cad5f59e012e46595522f374eb88e"
  },
  "continuity_evidence_ref": {
    "ref_id": "Beacon:continuity:entity-ester",
    "captured_at": "2026-08-27T00:15:00+02:00",
    "hash": "eaf211774556c2693dcec13faeceb16425c53f159867ab37788855fd2f81528e"
  },
  "l4_state_ref": {
    "ref_id": "L4:state:42",
    "captured_at": "2026-08-27T00:15:00+02:00",
    "hash": "e6df2d6f10ec4a74d51bae5c22a64204431dbcb94f4d1fa206679456cc13743c"
  },
  "memory_reliance_refs": [
    {
      "artifact_id": "memory-reliance-42",
      "version": "0.1.1",
      "hash": "320130041fb036475a64ca765fbe1b60aa7262307c0d4a95892a8869c02af5ac"
    }
  ],
  "target_effect": {
    "effect_id": "deploy:staging:A-to-B",
    "effect_class": "HIGH",
    "target_ref": "endpoint:A",
    "reversibility": "REVERSIBLE_WITH_COST"
  },
  "precondition_results": [
    {
      "name": "SOURCE_GROUNDING",
      "status": "FAIL",
      "evidence_ref": "AGL:grounding:expired-at-commit"
    },
    {
      "name": "IDENTITY_CONTINUITY",
      "status": "PASS",
      "evidence_ref": "Beacon:continuity:entity-ester"
    },
    {
      "name": "CURRENT_AUTHORITY",
      "status": "FAIL",
      "evidence_ref": "grant:revoked"
    },
    {
      "name": "PERIMETER",
      "status": "PASS",
      "evidence_ref": "perimeter:declared-surfaces"
    },
    {
      "name": "TIME_WINDOW",
      "status": "FAIL",
      "evidence_ref": "evidence:expired-at-10-02"
    },
    {
      "name": "L4_BUDGET",
      "status": "FAIL",
      "evidence_ref": "L4:state:budget-exceeded"
    },
    {
      "name": "MEMORY_RELIANCE",
      "status": "PASS_WITH_LIMITS",
      "evidence_ref": "memory-reliance-42"
    },
    {
      "name": "WITNESS_READINESS",
      "status": "PASS",
      "evidence_ref": "witness:ready"
    },
    {
      "name": "BLOCKING_STATE",
      "status": "FAIL",
      "evidence_ref": "queue:retry-pending-at-10-02"
    }
  ],
  "commit_outcome": "DENY",
  "effect_state": "NOT_BOUND",
  "effect_artifact_hash": null,
  "non_effect_witness_ref": {
    "artifact_id": "non-effect-42",
    "version": "0.1.1",
    "hash": "7f65c5176fa947aa8f440d6e5d8d920b7e3950df73e887425fe26c93034f06ad"
  },
  "previous_commit_record_ref": null,
  "change_reason": null,
  "current_conditions_ref": {
    "artifact_id": "current-conditions:earth-42",
    "version": "0.1",
    "hash": "fab5341a506787fec013823316bb215057e4b8638ed19074b711b26eb1afd998"
  },
  "current_conditions_hash": "fab5341a506787fec013823316bb215057e4b8638ed19074b711b26eb1afd998",
  "witness_chain_head": "c6d9afe0cd399fcb982337473a0556891cd28ba76ddd55a7f92b231c3f3f4325",
  "claim_boundary": "This record proves the bounded commit-time decision and declared effect state. It does not by itself prove global effect absence; that claim is delegated to the linked non-effect witness.",
  "change_reason_code": null,
  "target_transition_evidence_ref": null,
  "consequence_lineage_id": "consequence-lineage:earth-deploy-42"
}
